{
  "schema_version": "1.2",
  "artifact_type": "dependency_graph",
  "run_id": "run-mcp-git-baseline-2",
  "produced_at": "2026-05-01T20:24:46Z",
  "produced_by": "cbm-baseline-dependency@0.1",
  "source_sha": "4503e2d12b79",
  "inputs": [
    {
      "path": ".research/run-mcp-git-baseline-2/surface-map.json",
      "sha256": "24f662f3b17b65a6b37398f495b0ce21a6dba40697f08e63f83d4910f888032d"
    }
  ],
  "status": "draft",
  "coverage": {
    "scope": {
      "included_globs": [
        "**/*"
      ],
      "excluded_globs": [
        ".git/**",
        ".research/**",
        ".venv/**",
        "node_modules/**",
        "**/__pycache__/**",
        ".pytest_cache/**",
        ".DS_Store"
      ]
    },
    "result": {
      "files_in_scope": 31,
      "files_examined_directly": 0,
      "files_inspected_via_extractor": 31,
      "files_unread_in_scope": 31
    },
    "limitations": [
      "Phase A kernel records structure only; interpretive review remains a runtime-agent task."
    ]
  },
  "staleness": {
    "stale_if_input_hash_changes": true,
    "depends_on_paths": [
      ".gitignore",
      "pyproject.toml",
      "src/mcp_server_git/__init__.py",
      "src/mcp_server_git/server.py"
    ],
    "scope_signature": "286ec4ed090333a7e1e5865b0bd28fc337e2784bbdc7ff943196fc17607b3150"
  },
  "partition_counts": {
    "certain": 16,
    "suspected": 0,
    "advisory": 0,
    "unknown": 1
  },
  "edges": [
    {
      "id": "edge-call-001",
      "kind": "call",
      "from": {
        "path": "src/mcp_server_git/__init__.py"
      },
      "to": {
        "path": "src/mcp_server_git/__init__.py",
        "symbol": "main"
      },
      "citations": [
        "src/mcp_server_git/__init__.py:24@4503e2d12b79"
      ],
      "extractor_id": "ext-python-calls-v1",
      "claim_register": "factual",
      "claim_status": "active",
      "evidence_kinds": [
        "static_relation"
      ],
      "corroboration_count": 1,
      "confidence": "high"
    },
    {
      "id": "edge-call-002",
      "kind": "call",
      "from": {
        "path": "src/mcp_server_git/server.py"
      },
      "to": {
        "path": "src/mcp_server_git/server.py",
        "symbol": "by_commandline"
      },
      "citations": [
        "src/mcp_server_git/server.py:468@4503e2d12b79"
      ],
      "extractor_id": "ext-python-calls-v1",
      "claim_register": "factual",
      "claim_status": "active",
      "evidence_kinds": [
        "static_relation"
      ],
      "corroboration_count": 1,
      "confidence": "high"
    },
    {
      "id": "edge-call-003",
      "kind": "call",
      "from": {
        "path": "src/mcp_server_git/server.py"
      },
      "to": {
        "path": "src/mcp_server_git/server.py",
        "symbol": "validate_repo_path"
      },
      "citations": [
        "src/mcp_server_git/server.py:477@4503e2d12b79"
      ],
      "extractor_id": "ext-python-calls-v1",
      "claim_register": "factual",
      "claim_status": "active",
      "evidence_kinds": [
        "static_relation"
      ],
      "corroboration_count": 1,
      "confidence": "high"
    },
    {
      "id": "edge-call-004",
      "kind": "call",
      "from": {
        "path": "src/mcp_server_git/server.py"
      },
      "to": {
        "path": "src/mcp_server_git/server.py",
        "symbol": "by_roots"
      },
      "citations": [
        "src/mcp_server_git/server.py:469@4503e2d12b79"
      ],
      "extractor_id": "ext-python-calls-v1",
      "claim_register": "factual",
      "claim_status": "active",
      "evidence_kinds": [
        "static_relation"
      ],
      "corroboration_count": 1,
      "confidence": "high"
    },
    {
      "id": "edge-call-005",
      "kind": "call",
      "from": {
        "path": "src/mcp_server_git/server.py"
      },
      "to": {
        "path": "src/mcp_server_git/server.py",
        "symbol": "git_status"
      },
      "citations": [
        "src/mcp_server_git/server.py:484@4503e2d12b79"
      ],
      "extractor_id": "ext-python-calls-v1",
      "claim_register": "factual",
      "claim_status": "active",
      "evidence_kinds": [
        "static_relation"
      ],
      "corroboration_count": 1,
      "confidence": "high"
    },
    {
      "id": "edge-call-006",
      "kind": "call",
      "from": {
        "path": "src/mcp_server_git/server.py"
      },
      "to": {
        "path": "src/mcp_server_git/server.py",
        "symbol": "git_diff_unstaged"
      },
      "citations": [
        "src/mcp_server_git/server.py:491@4503e2d12b79"
      ],
      "extractor_id": "ext-python-calls-v1",
      "claim_register": "factual",
      "claim_status": "active",
      "evidence_kinds": [
        "static_relation"
      ],
      "corroboration_count": 1,
      "confidence": "high"
    },
    {
      "id": "edge-call-007",
      "kind": "call",
      "from": {
        "path": "src/mcp_server_git/server.py"
      },
      "to": {
        "path": "src/mcp_server_git/server.py",
        "symbol": "git_diff_staged"
      },
      "citations": [
        "src/mcp_server_git/server.py:498@4503e2d12b79"
      ],
      "extractor_id": "ext-python-calls-v1",
      "claim_register": "factual",
      "claim_status": "active",
      "evidence_kinds": [
        "static_relation"
      ],
      "corroboration_count": 1,
      "confidence": "high"
    },
    {
      "id": "edge-call-008",
      "kind": "call",
      "from": {
        "path": "src/mcp_server_git/server.py"
      },
      "to": {
        "path": "src/mcp_server_git/server.py",
        "symbol": "git_diff"
      },
      "citations": [
        "src/mcp_server_git/server.py:505@4503e2d12b79"
      ],
      "extractor_id": "ext-python-calls-v1",
      "claim_register": "factual",
      "claim_status": "active",
      "evidence_kinds": [
        "static_relation"
      ],
      "corroboration_count": 1,
      "confidence": "high"
    },
    {
      "id": "edge-call-009",
      "kind": "call",
      "from": {
        "path": "src/mcp_server_git/server.py"
      },
      "to": {
        "path": "src/mcp_server_git/server.py",
        "symbol": "git_commit"
      },
      "citations": [
        "src/mcp_server_git/server.py:512@4503e2d12b79"
      ],
      "extractor_id": "ext-python-calls-v1",
      "claim_register": "factual",
      "claim_status": "active",
      "evidence_kinds": [
        "static_relation"
      ],
      "corroboration_count": 1,
      "confidence": "high"
    },
    {
      "id": "edge-call-010",
      "kind": "call",
      "from": {
        "path": "src/mcp_server_git/server.py"
      },
      "to": {
        "path": "src/mcp_server_git/server.py",
        "symbol": "git_add"
      },
      "citations": [
        "src/mcp_server_git/server.py:519@4503e2d12b79"
      ],
      "extractor_id": "ext-python-calls-v1",
      "claim_register": "factual",
      "claim_status": "active",
      "evidence_kinds": [
        "static_relation"
      ],
      "corroboration_count": 1,
      "confidence": "high"
    },
    {
      "id": "edge-call-011",
      "kind": "call",
      "from": {
        "path": "src/mcp_server_git/server.py"
      },
      "to": {
        "path": "src/mcp_server_git/server.py",
        "symbol": "git_reset"
      },
      "citations": [
        "src/mcp_server_git/server.py:526@4503e2d12b79"
      ],
      "extractor_id": "ext-python-calls-v1",
      "claim_register": "factual",
      "claim_status": "active",
      "evidence_kinds": [
        "static_relation"
      ],
      "corroboration_count": 1,
      "confidence": "high"
    },
    {
      "id": "edge-call-012",
      "kind": "call",
      "from": {
        "path": "src/mcp_server_git/server.py"
      },
      "to": {
        "path": "src/mcp_server_git/server.py",
        "symbol": "git_log"
      },
      "citations": [
        "src/mcp_server_git/server.py:534@4503e2d12b79"
      ],
      "extractor_id": "ext-python-calls-v1",
      "claim_register": "factual",
      "claim_status": "active",
      "evidence_kinds": [
        "static_relation"
      ],
      "corroboration_count": 1,
      "confidence": "high"
    },
    {
      "id": "edge-call-013",
      "kind": "call",
      "from": {
        "path": "src/mcp_server_git/server.py"
      },
      "to": {
        "path": "src/mcp_server_git/server.py",
        "symbol": "git_create_branch"
      },
      "citations": [
        "src/mcp_server_git/server.py:546@4503e2d12b79"
      ],
      "extractor_id": "ext-python-calls-v1",
      "claim_register": "factual",
      "claim_status": "active",
      "evidence_kinds": [
        "static_relation"
      ],
      "corroboration_count": 1,
      "confidence": "high"
    },
    {
      "id": "edge-call-014",
      "kind": "call",
      "from": {
        "path": "src/mcp_server_git/server.py"
      },
      "to": {
        "path": "src/mcp_server_git/server.py",
        "symbol": "git_checkout"
      },
      "citations": [
        "src/mcp_server_git/server.py:557@4503e2d12b79"
      ],
      "extractor_id": "ext-python-calls-v1",
      "claim_register": "factual",
      "claim_status": "active",
      "evidence_kinds": [
        "static_relation"
      ],
      "corroboration_count": 1,
      "confidence": "high"
    },
    {
      "id": "edge-call-015",
      "kind": "call",
      "from": {
        "path": "src/mcp_server_git/server.py"
      },
      "to": {
        "path": "src/mcp_server_git/server.py",
        "symbol": "git_show"
      },
      "citations": [
        "src/mcp_server_git/server.py:564@4503e2d12b79"
      ],
      "extractor_id": "ext-python-calls-v1",
      "claim_register": "factual",
      "claim_status": "active",
      "evidence_kinds": [
        "static_relation"
      ],
      "corroboration_count": 1,
      "confidence": "high"
    },
    {
      "id": "edge-call-016",
      "kind": "call",
      "from": {
        "path": "src/mcp_server_git/server.py"
      },
      "to": {
        "path": "src/mcp_server_git/server.py",